{
  "$schema": "http://json-schema.org/draft-07/schema#",
  "$id": "https://aegis.dev/schema/governance.schema.json",
  "title": "Aegis Governance",
  "description": "The global operating rules that apply to every agent in this workspace, regardless of role. This is the employee handbook — the policies everyone must follow. Required fields define the universal skeleton. Additional fields are permitted for domain-specific governance (cross-domain rules, data policies, sensitivity handling).",
  "type": "object",
  "required": ["version", "autonomy", "permissions", "quality_gate"],
  "definitions": {
    "autonomy_level": {
      "type": "string",
      "enum": ["conservative", "advisory", "delegated"],
      "description": "conservative: Agent never acts without explicit human approval. advisory: Agent surfaces recommendations and waits for approval. delegated: Agent acts on its own judgment and reports afterward."
    },
    "enforcement_level": {
      "type": "string",
      "enum": ["strict", "preferred", "suggestion"],
      "description": "strict: Violation is never acceptable. preferred: Follow unless there is a compelling reason not to. suggestion: Consider this but use judgment."
    }
  },
  "properties": {
    "$schema": {
      "type": "string",
      "description": "Reference to the Aegis governance schema for validation."
    },
    "version": {
      "type": "string",
      "pattern": "^\\d+\\.\\d+\\.\\d+$",
      "description": "Aegis schema version this file conforms to."
    },
    "autonomy": {
      "type": "object",
      "description": "The autonomy framework. For each operational domain, how much independent authority do agents have? This is the CEO telling the COO which decisions require a phone call and which can be handled independently.",
      "required": ["default_level"],
      "properties": {
        "default_level": {
          "$ref": "#/definitions/autonomy_level",
          "description": "The fallback autonomy level for any domain not explicitly configured."
        },
        "domains": {
          "type": "object",
          "description": "Override autonomy levels for specific operational domains. Standard domains (code_modification, dependency_management, etc.) are predefined but the schema accepts any domain string — the project's needs dictate the domains, not a predetermined list.",
          "additionalProperties": {
            "$ref": "#/definitions/autonomy_level"
          },
          "properties": {
            "code_modification": {
              "$ref": "#/definitions/autonomy_level",
              "description": "Writing or modifying source code files."
            },
            "dependency_management": {
              "$ref": "#/definitions/autonomy_level",
              "description": "Adding, removing, or updating project dependencies."
            },
            "file_creation": {
              "$ref": "#/definitions/autonomy_level",
              "description": "Creating new files or directories."
            },
            "file_deletion": {
              "$ref": "#/definitions/autonomy_level",
              "description": "Deleting existing files or directories."
            },
            "configuration_changes": {
              "$ref": "#/definitions/autonomy_level",
              "description": "Modifying config files, environment variables, CI/CD pipelines."
            },
            "infrastructure_changes": {
              "$ref": "#/definitions/autonomy_level",
              "description": "Modifying infrastructure-as-code, deployment configs, cloud resources."
            },
            "agent_recruitment": {
              "$ref": "#/definitions/autonomy_level",
              "description": "Creating new scoped roles or recommending multi-agent workflows."
            },
            "test_modification": {
              "$ref": "#/definitions/autonomy_level",
              "description": "Adding, modifying, or removing tests."
            },
            "documentation": {
              "$ref": "#/definitions/autonomy_level",
              "description": "Creating or updating documentation, comments, READMEs."
            },
            "refactoring": {
              "$ref": "#/definitions/autonomy_level",
              "description": "Restructuring code without changing functionality."
            }
          }
        }
      },
      "additionalProperties": true
    },
    "permissions": {
      "type": "object",
      "description": "Explicit access control. What can agents touch, what is read-only, and what is completely off-limits?",
      "required": ["boundaries"],
      "properties": {
        "boundaries": {
          "type": "object",
          "properties": {
            "writable": {
              "type": "array",
              "items": { "type": "string" },
              "description": "Glob patterns for paths agents may modify. If empty, nothing is writable by default.",
              "examples": [["src/**", "tests/**", "docs/**"]]
            },
            "read_only": {
              "type": "array",
              "items": { "type": "string" },
              "description": "Glob patterns for paths agents may read but never modify.",
              "examples": [["config/**", ".github/**"]]
            },
            "forbidden": {
              "type": "array",
              "items": { "type": "string" },
              "description": "Glob patterns for paths agents must never read or modify. Treat as if these paths do not exist.",
              "examples": [[".env*", "secrets/**", "infrastructure/production/**"]]
            }
          },
          "additionalProperties": true
        },
        "sensitive_patterns": {
          "type": "array",
          "description": "Regex patterns for content scanning — matched against the text content of files to detect secrets, credentials, API keys, real data, or other sensitive strings agents should never generate or include in code. This field is for CONTENT scanning only. Do not use it for path-based approval routing — use role scoping (scope.excluded_paths) and escalation triggers for that.",
          "items": {
            "type": "object",
            "required": ["pattern", "reason"],
            "properties": {
              "pattern": {
                "type": "string",
                "description": "Regex pattern matched against file content. Must be a valid regular expression, not a file path or glob. Examples of correct patterns: credential detectors, secret formats, real data markers. Examples of incorrect patterns: 'audit/**', 'infra/**', '.env*' (these are paths, not content — use permissions.boundaries or escalation triggers instead).",
                "examples": ["(AKID|AKIA)[A-Z0-9]{16}", "-----BEGIN.*PRIVATE KEY-----", "password\\s*=\\s*['\"]", "API_KEY_.*"]
              },
              "reason": {
                "type": "string",
                "description": "Why this is sensitive."
              }
            },
            "additionalProperties": true
          }
        }
      },
      "additionalProperties": true
    },
    "quality_gate": {
      "type": "object",
      "description": "The minimum quality bar that must be met before any agent considers a task complete. This is the definition of 'done.' The pre_commit object defines the universal baseline. Additional fields and richer gate definitions are permitted for domain-specific quality requirements.",
      "required": ["pre_commit"],
      "properties": {
        "pre_commit": {
          "type": "object",
          "description": "Checks that must pass before an agent commits or submits work.",
          "properties": {
            "must_pass_tests": {
              "type": "boolean",
              "default": true,
              "description": "All existing tests must pass."
            },
            "must_pass_lint": {
              "type": "boolean",
              "default": true,
              "description": "Linting must pass with zero errors."
            },
            "must_pass_typecheck": {
              "type": "boolean",
              "default": false,
              "description": "Type checking must pass (for typed languages)."
            },
            "must_add_tests": {
              "type": "boolean",
              "default": false,
              "description": "New functionality must include corresponding tests."
            },
            "must_update_docs": {
              "type": "boolean",
              "default": false,
              "description": "Changes must include documentation updates where relevant."
            },
            "max_files_changed": {
              "type": "integer",
              "minimum": 1,
              "description": "Maximum number of files an agent should modify in a single task. Encourages scoped, reviewable changes.",
              "examples": [20]
            },
            "custom_checks": {
              "type": "array",
              "description": "Additional commands that must succeed before work is considered complete.",
              "items": {
                "type": "object",
                "required": ["name", "command"],
                "properties": {
                  "name": { "type": "string" },
                  "command": { "type": "string" },
                  "description": { "type": "string" }
                },
                "additionalProperties": true
              }
            }
          },
          "additionalProperties": true
        }
      },
      "additionalProperties": true
    },
    "conventions": {
      "type": "array",
      "description": "Explicit coding and architectural conventions. Each convention is a machine-queryable rule, not prose. An agent can look up: 'What is the convention for X in scope Y?' and get a deterministic answer.",
      "items": {
        "type": "object",
        "required": ["id", "scope", "rule", "enforcement"],
        "properties": {
          "id": {
            "type": "string",
            "pattern": "^[a-z][a-z0-9_-]*$",
            "description": "Unique identifier for this convention. Used for lookups and overrides in role files.",
            "examples": ["component_style", "error_handling", "state_management"]
          },
          "scope": {
            "type": "string",
            "description": "Glob pattern for which files/directories this convention applies to. Use 'global' for project-wide.",
            "examples": ["global", "src/frontend/**", "services/api/**"]
          },
          "rule": {
            "type": "string",
            "description": "The category of this convention.",
            "examples": ["component_style", "error_handling", "naming", "imports", "state_management", "testing_pattern", "architecture_pattern"]
          },
          "value": {
            "type": "string",
            "description": "The prescribed value or pattern.",
            "examples": ["functional", "result_type", "camelCase", "repository_pattern"]
          },
          "allowed": {
            "type": "array",
            "items": { "type": "string" },
            "description": "Explicitly allowed options (whitelist).",
            "examples": [["zustand", "jotai"]]
          },
          "forbidden": {
            "type": "array",
            "items": { "type": "string" },
            "description": "Explicitly forbidden options (blacklist).",
            "examples": [["redux", "mobx"]]
          },
          "enforcement": {
            "$ref": "#/definitions/enforcement_level"
          },
          "rationale": {
            "type": "string",
            "description": "Brief explanation of why this convention exists. Helps agents make judgment calls in edge cases."
          }
        },
        "additionalProperties": true
      }
    },
    "escalation": {
      "type": "object",
      "description": "What should agents do when they encounter situations not covered by policy? The three baseline behaviors are required. Additional fields (triggers, target, behavior descriptions) are permitted for domain-specific escalation protocols.",
      "properties": {
        "on_ambiguity": {
          "type": "string",
          "enum": ["stop_and_ask", "best_judgment_and_flag", "best_judgment_silent"],
          "default": "stop_and_ask",
          "description": "When the policy does not cover a situation: stop_and_ask: Halt and request human guidance. best_judgment_and_flag: Proceed with best judgment but flag the decision for review. best_judgment_silent: Proceed without flagging."
        },
        "on_conflict": {
          "type": "string",
          "enum": ["stop_and_ask", "principles_win", "convention_wins"],
          "default": "stop_and_ask",
          "description": "When two rules or conventions appear to conflict: stop_and_ask: Request human resolution. principles_win: Defer to the project principles by priority order. convention_wins: Follow the more specific convention."
        },
        "on_scope_boundary": {
          "type": "string",
          "enum": ["stop_and_ask", "flag_and_suggest", "stay_in_lane"],
          "default": "stay_in_lane",
          "description": "When a task requires changes outside the agent's assigned scope: stop_and_ask: Request permission. flag_and_suggest: Note what needs to change in the other scope but don't touch it. stay_in_lane: Only work within assigned scope, silently skip out-of-scope work."
        }
      },
      "additionalProperties": true
    },
    "override_protocol": {
      "type": "object",
      "description": "What happens when a human instructs an agent to take an action that violates a governance policy. Agents cannot refuse a direct human instruction, but they can — and must — ensure the override is informed, documented, and auditable. This is the governance equivalent of a signed waiver: the human has the authority to override, but the override goes on record.",
      "properties": {
        "behavior": {
          "type": "string",
          "enum": ["block_and_log", "warn_confirm_and_log", "log_only"],
          "default": "warn_confirm_and_log",
          "description": "block_and_log: Agent refuses the action entirely, logs the attempt, and directs the human to modify the policy first. Only enforceable with a runtime layer. warn_confirm_and_log: Agent identifies the specific policy being violated, presents it to the human, requires explicit confirmation to proceed, and logs the override. This is the recommended default. log_only: Agent complies with the instruction but silently logs the policy violation. Least protective but still auditable."
        },
        "log_path": {
          "type": "string",
          "default": ".agentpolicy/state/overrides.jsonl",
          "description": "Path to the append-only override log file relative to project root. Each entry is a single JSON line. This file must never be modified or truncated — append only."
        },
        "log_entry_schema": {
          "type": "object",
          "description": "The structure of each override log entry. Defines what gets recorded when a policy is overridden.",
          "properties": {
            "timestamp": {
              "type": "string",
              "format": "date-time",
              "description": "When the override occurred."
            },
            "policy_violated": {
              "type": "string",
              "description": "The specific policy ID, principle name, or governance rule that was violated.",
              "examples": ["principle:compliance-supremacy", "convention:no_hardcoded_secrets", "permission:forbidden_path"]
            },
            "policy_text": {
              "type": "string",
              "description": "The full text or summary of the policy that was violated, so the log is self-contained and readable without cross-referencing."
            },
            "action_requested": {
              "type": "string",
              "description": "What the human instructed the agent to do."
            },
            "human_confirmed": {
              "type": "boolean",
              "description": "Whether the human explicitly confirmed the override after being informed of the policy violation."
            },
            "agent_role": {
              "type": "string",
              "description": "Which agent role was operating when the override occurred.",
              "examples": ["default", "payments", "compliance"]
            },
            "rationale": {
              "type": "string",
              "description": "Optional rationale provided by the human for why the override is necessary."
            }
          },
          "additionalProperties": true
        },
        "immutable_policies": {
          "type": "array",
          "items": { "type": "string" },
          "description": "Policy IDs that cannot be overridden even with human confirmation. These require the human to modify the governance files directly through Aegis rather than bypassing them in conversation. For projects with runtime enforcement, these are hard blocks. Without runtime enforcement, agents should refuse and explain that the policy must be changed through 'aegis init' rather than overridden in conversation.",
          "examples": [["principle:compliance-supremacy", "principle:audit-trail-completeness"]]
        }
      },
      "additionalProperties": true
    }
  },
  "additionalProperties": true
}
